Id,Product_id,Link,Description,Result Date
"570. Merchandise imports and exports, by major groups and principal trading areas for all countries, monthly Archived",Table: 12-10-0013-01,https://www150.statcan.gc.ca/t1/tbl1/en/tv.action?pid=1210001301,"Description: This table contains 592 series, with data for years 1971 - 2012 (not all combinations necessarily have data for all years).  This table contains data described by the following...Description: This table contains 592 series, with data for years 1971 - 2012 (not all combinations necessarily have data for all years).  This table contains data described by the following dimensions (Not all combinations are available): Geography (1 items: Canada ...), Basis (2 items: Customs;Balance of payments ...), Seasonal adjustment (2 items: Unadjusted;Seasonally adjusted ...), Import and export major commodity groups and principal trading areas (149 items: Imports; total of all merchandise;Imports; Section 1 Live animals;Imports; Major group 2.1 Meat and meat preparations;Imports; Section 2 Food; feed; beverages and tobacco ...).More",2017-02-08
"571. Merchandise imports and exports, by major groups and principal trading areas for all countries, quarterly Archived",Table: 12-10-0014-01,https://www150.statcan.gc.ca/t1/tbl1/en/tv.action?pid=1210001401,"Description: This table contains 592 series, with data for years 1971 - 2012 (not all combinations necessarily have data for all years).  This table contains data described by the following...Description: This table contains 592 series, with data for years 1971 - 2012 (not all combinations necessarily have data for all years).  This table contains data described by the following dimensions (Not all combinations are available): Geography (1 items: Canada ...), Basis (2 items: Customs;Balance of payments ...), Seasonal adjustment (2 items: Unadjusted;Seasonally adjusted ...), Import and export major commodity groups and principal trading areas (149 items: Imports; total of all merchandise;Imports; Section 1 Live animals;Imports; Section 2 Food; feed; beverages and tobacco;Imports; Major group 2.1 Meat and meat preparations ...).More",2017-02-08
"572. Merchandise imports and exports, customs basis, for all countries, by Broad Economic Categories and top sixty trading partners",Table: 12-10-0090-01,https://www150.statcan.gc.ca/t1/tbl1/en/tv.action?pid=1210009001,"Description: This table contains 3904 series, with data for years 2000 - 2016 (not all combinations necessarily have data for all years).     This table contains data described by the following...Description: This table contains 3904 series, with data for years 2000 - 2016 (not all combinations necessarily have data for all years).     This table contains data described by the following dimensions (Not all combinations are available):  Geography (1 item: Canada);  Trade (2 items: Import; Export);  Top sixty trading partners (61 items: Total of all countries; United States; China; Mexico; ...);  Classification by Broad Economic Categories (BEC4) (32 items: Food and beverages; Food and beverages, primary; Food and beverages, primary, mainly for industry; Food and beverages, primary, mainly for household consumption; ...).More",2018-07-06
"573. Merchandise imports classified by commodity, Paasche Price Index (1981 and 1986), balance of payments basis Archived",Table: 10-10-0096-01,https://www150.statcan.gc.ca/t1/tbl1/en/tv.action?pid=1010009601,"Description: This table contains 40 series, with data for years 1971 - 1997 (not all combinations necessarily have data for all years), and was last released on 2000-02-19. This table contains data...Description: This table contains 40 series, with data for years 1971 - 1997 (not all combinations necessarily have data for all years), and was last released on 2000-02-19. This table contains data described by the following dimensions (Not all combinations are available): Geography (1 items: Canada ...), Prices (4 items: Paasche Price Index; 1981=100; seasonally adjusted; Paasche Price Index; 1986=100; seasonally adjusted; Constant 1986 dollars; seasonally adjusted at annual rates; Constant 1981 dollars; seasonally adjusted at annual rates ...), Commodity classification (10 items: Total; merchandise imports; Other energy products; Food; Crude petroleum ...).More",2000-02-19
"574. Merchandise imports classified by commodity, Paasche Price Index (1992=100, seasonally adjusted), 1992 and current dollars (seasonally adjusted at annual rates) Archived",Table: 10-10-0077-01,https://www150.statcan.gc.ca/t1/tbl1/en/tv.action?pid=1010007701,"Description: This table contains 51 series, with data for years 1971 - 2001 (not all combinations necessarily have data for all years), and was last released on 2001-09-20. This table contains data...Description: This table contains 51 series, with data for years 1971 - 2001 (not all combinations necessarily have data for all years), and was last released on 2001-09-20. This table contains data described by the following dimensions (Not all combinations are available): Geography (1 items: Canada ...), Prices (3 items: Paasche Price Index; 1992=100; Current dollars; seasonally adjusted at annual rates; Constant 1992 dollars; seasonally adjusted at annual rates ...), Commodity classification (31 items: Total; merchandise imports; Fresh fruits and vegetables; Total; commodities; Total; food ...).More",2001-09-20
"575. Merchandising inventories, retail chain store stocks, by selected kinds of business, inactive Archived",Table: 20-10-0063-01,https://www150.statcan.gc.ca/t1/tbl1/en/tv.action?pid=2010006301,"Description: This table contains 151 series, with data for years 1966 - 1997 (not all combinations necessarily have data for all years), and is no longer being released. This table contains data...Description: This table contains 151 series, with data for years 1966 - 1997 (not all combinations necessarily have data for all years), and is no longer being released. This table contains data described by the following dimensions (Not all combinations are available): Geography (1 item: Canada), Method of sale (6 items: Total direct sales; Sales from premises; Door-to-door sales; Sales by mail; ...), Commodity group (31 items: Total, all commodities; Meat, fish and poultry; Frozen food plans; Dairy products; ...).More",2017-04-20
"576. Methods enterprises use to access the Internet (low speed or high speed), by industry Archived",Table: 22-10-0048-01,https://www150.statcan.gc.ca/t1/tbl1/en/tv.action?pid=2210004801,"Description: Electronic commerce and technology, enterprises' perceived benefits of conducting business over the Internet by North American Industry Classification System (NAICS), for Canada from...Description: Electronic commerce and technology, enterprises' perceived benefits of conducting business over the Internet by North American Industry Classification System (NAICS), for Canada from 2001 to 2007. (Terminated)More",2010-03-09
577. Milk production and utilization,Table: 32-10-0113-01,https://www150.statcan.gc.ca/t1/tbl1/en/tv.action?pid=3210011301,"Description: Milk production and utilization, Canada and provinces (in kilolitres). Data are available on a monthly basis.",2019-05-27
"578. Month-to-month percentage changes in estimated levels of sales of wholesale merchants, seasonally adjusted, inactive Archived",Table: 20-10-0046-01,https://www150.statcan.gc.ca/t1/tbl1/en/tv.action?pid=2010004601,"Description: This table contains 15 series, with data for years 1983 - 1989 (not all combinations necessarily have data for all years), and was last released on 2000-02-18.  This table contains data...Description: This table contains 15 series, with data for years 1983 - 1989 (not all combinations necessarily have data for all years), and was last released on 2000-02-18.  This table contains data described by the following dimensions (Not all combinations are available): Geography (6 items: Canada;Quebec;Ontario;Atlantic provinces ...), Trade group (10 items: Total; all trades;Food;Tobacco; drugs and toilet preparations;Apparel; dry goods; furniture and general merchandise ...).More",2017-04-20
579. Monthly average retail prices for food and other selected products,Table: 18-10-0002-01,https://www150.statcan.gc.ca/t1/tbl1/en/tv.action?pid=1810000201,"Description: Monthly average retail prices for food, household supplies, personal care items, cigarettes and gasoline. Prices are presented for the current month and previous four months. Prices...Description: Monthly average retail prices for food, household supplies, personal care items, cigarettes and gasoline. Prices are presented for the current month and previous four months. Prices are in Canadian current dollars. More",2019-06-19
580. Monthly survey of food services and drinking places,Table: 21-10-0019-01,https://www150.statcan.gc.ca/t1/tbl1/en/tv.action?pid=2110001901,"Description: Seasonally adjusted receipts of monthly survey of food services and drinking places, by North American Industry Classification System (NAICS), monthly, for five months of data.",2019-06-20
581. Monthly Survey of Manufacturing Archived,Table: 31-001-X,/n1/en/catalogue/31-001-X,"Description: This publication provides estimated values of manufacturers' shipments, inventories and orders by month. Data are presented for 21 major groups and selected individual industries at...Description: This publication provides estimated values of manufacturers' shipments, inventories and orders by month. Data are presented for 21 major groups and selected individual industries at the 3- to 6-digit level of detail, as defined by the 1997 North American Industry Classification System (NAICS), as well as aggregates for durable, non-durable and total manufacturing. Major group industry data are shown with and without adjustment for seasonal variation. Unadjusted shipment totals by province and by major groups within provinces are also shown. These data are used to monitor the business cycle in the manufacturing sector of the economy, to evaluate and develop financial and industrial policy, and to provide market data at the detailed industry level. Related information on manufacturers' opinions on the current state of inventories and orders and about employment and production prospects over the next three months are available from the Business Conditions Survey (BCS). The survey is carried out at the beginning of January, April, July and October. Responses are available approximately five days after the reference month in Statistics Canada's The Daily. The BCS balance of opinion data often serves as a good guide to the direction of change, at least a month in advance of the corresponding quantitative data.More",2005-02-15
"582. Motion picture theatres, sales",Table: 21-10-0181-01,https://www150.statcan.gc.ca/t1/tbl1/en/tv.action?pid=2110018101,"Description: The sales by North American Industry Classification System  (NAICS 512130) of Motion picture and video exhibition which include: all  members under Sales,  every two years (dollars) for...Description: The sales by North American Industry Classification System  (NAICS 512130) of Motion picture and video exhibition which include: all  members under Sales,  every two years (dollars) for five years of data.More",2018-06-07
"583. Multifactor productivity and related variables in the aggregate business sector and major sub-sectors, by industry",Table: 36-10-0211-01,https://www150.statcan.gc.ca/t1/tbl1/en/tv.action?pid=3610021101,"Description: Multifactor productivity and related variables in the aggregate business sector and major sub-sectors, by North American Industry Classification System (NAICS), provinces.",2019-04-12
"584. Multifactor productivity, gross output, value-added, capital, labour and intermediate inputs at a detailed industry level",Table: 36-10-0217-01,https://www150.statcan.gc.ca/t1/tbl1/en/tv.action?pid=3610021701,"Description: Multifactor productivity, gross output, value-added, capital, labour and intermediate inputs at a detailed industry level, by North American Industry Classification System (NAICS)...Description: Multifactor productivity, gross output, value-added, capital, labour and intermediate inputs at a detailed industry level, by North American Industry Classification System (NAICS), annual (index, 2002=100).More",2019-03-08
"585. Multifactor productivity, gross output, value-added, capital, labour and intermediate inputs at a detailed industry level, by North American Industry Classification System (NAICS) Archived",Table: 36-10-0309-01,https://www150.statcan.gc.ca/t1/tbl1/en/tv.action?pid=3610030901,"Description: This table contains 1647 series, with data for years 1961 - 2008 (not all combinations necessarily have data for all years).  This table contains data described by the following...Description: This table contains 1647 series, with data for years 1961 - 2008 (not all combinations necessarily have data for all years).  This table contains data described by the following dimensions (Not all combinations are available): Geography (1 items: Canada ...), Multifactor productivity and related variables (27 items: Labour productivity based on gross output; Labour productivity based on value-added; Multifactor productivity based on value-added; Multifactor productivity based on gross output ...), North American Industry Classification System (NAICS) (61 items: Agriculture; forestry; fishing and hunting; Crop and animal production; Fishing; hunting and trapping; Forestry and logging ...).More",2014-04-23
"586. Multifactor productivity, gross output, value-added, capital, labour and intermediate inputs by business sector industries, according to the Standard Industrial Classification, 1980 (SIC) Archived",Table: 36-10-0310-01,https://www150.statcan.gc.ca/t1/tbl1/en/tv.action?pid=3610031001,"Description: This table contains 1404 series, with data for years 1961 - 1997 (not all combinations necessarily have data for all years), and was last released on 2009-01-22. This table contains...Description: This table contains 1404 series, with data for years 1961 - 1997 (not all combinations necessarily have data for all years), and was last released on 2009-01-22. This table contains data described by the following dimensions (Not all combinations are available): Geography (1 items: Canada ...), Multifactor productivity and related variables (27 items: Multifactor productivity based on gross output; Multifactor productivity based on value-added; Labour productivity based on value-added; Labour productivity based on gross output ...), Standard Industrial Classification (SIC) (52 items: Agricultural and related services industries; Mining (including milling); quarrying and oil well industries; Fishing and trapping industries; Logging and forestry industries ...).More",2009-01-22
"587. Multifactor productivity, value-added, capital input and labour input in the aggregate business sector and major sub-sectors, by industry",Table: 36-10-0208-01,https://www150.statcan.gc.ca/t1/tbl1/en/tv.action?pid=3610020801,"Description: Multifactor productivity, value-added, capital input and labour input in the aggregate business sector and major sub-sectors, by North American Industry Classification System (NAICS)...Description: Multifactor productivity, value-added, capital input and labour input in the aggregate business sector and major sub-sectors, by North American Industry Classification System (NAICS), annual (index, 2002=100).More",2019-03-08
"588. Multiple jobholders by industry, annual",Table: 14-10-0044-01,https://www150.statcan.gc.ca/t1/tbl1/en/tv.action?pid=1410004401,"Description: Number of multiple jobholders by North American Industry Classification System (NAICS), sex and age group, last 5 years.",2019-01-04
"589. Multiple jobholders by industry, monthly, unadjusted for seasonality",Table: 14-10-0045-01,https://www150.statcan.gc.ca/t1/tbl1/en/tv.action?pid=1410004501,"Description: Number of multiple jobholders by North American Industry Classification System (NAICS), sex and age group, last 5 months.",2019-06-07
"590. National Tourism Indicators, Historical Estimates Archived",Table: 13-220-X,/n1/en/catalogue/13-220-X,"Description: In the 1997 edition, new and revised benchmarks were introduced for 1992 and 1988. The indicators are used to monitor supply, demand and employment for tourism in Canada on a timely...Description: In the 1997 edition, new and revised benchmarks were introduced for 1992 and 1988. The indicators are used to monitor supply, demand and employment for tourism in Canada on a timely basis. The annual tables are derived using the National Income and Expenditure Accounts (NIEA) and various industry and travel surveys. Tables providing actual data and percentage changes, for seasonally adjusted current and constant price estimates are included. In addition, an analytical section provides graphs, and time series of first differences, percentage changes, and seasonal factors for selected indicators. Data are published from 1987 and the publication will be available on the day of release. New data are included in the demand tables for non-tourism commodities produced by non-tourism industries and in the employment tables covering direct tourism employment generated by non-tourism industries. This product was commissioned by the Canadian Tourism Commission to provide annual updates for the Tourism Satellite Account.More",2003-01-08
"591. National Tourism Indicators, Quarterly Estimates Archived",Table: 13-009-X,/n1/en/catalogue/13-009-X,"Description: The National Tourism Indicators (NTI) are used to monitor supply, demand, employment and GDP for tourism in Canada on a timely basis. Estimates go back to the first quarter of 1986...Description: The National Tourism Indicators (NTI) are used to monitor supply, demand, employment and GDP for tourism in Canada on a timely basis. Estimates go back to the first quarter of 1986, and is no longer being released. The indicators are based on benchmarks taken from the Tourism Satellite Accounts. The quarterly statistics are derived using selected components of consumer spending and of GDP by industry and various industry and travel surveys. They are available about 90 days after the reference period. The NTI provide seasonally adjusted, current and constant price estimates, both actual levels and percentage changes. A brief analysis of the quarterly results is included as well as occasional articles. This product was commissioned by the Canadian Tourism Commission to provide quarterly updates for the Tourism Satellite Account.More",2012-09-28
592. Number and percentage distribution of apprenticeship program registrations by major trade group and sex,Table: 37-10-0118-02,https://www150.statcan.gc.ca/t1/tbl1/en/tv.action?pid=3710011802,"Description: Number and percentage distribution of registered apprentices, by sex and major trade groups. This table is included in Section D: Postsecondary education: Enrolment in postsecondary...Description: Number and percentage distribution of registered apprentices, by sex and major trade groups. This table is included in Section D: Postsecondary education: Enrolment in postsecondary education of the Pan Canadian Education Indicators Program (PCEIP). PCEIP draws from a wide variety of data sources to provide information on the school-age population, elementary, secondary and postsecondary education, transitions, education finance and labour market outcomes. The program presents indicators for all of Canada, the provinces, the territories, as well as selected international comparisons and comparisons over time. PCEIP is an ongoing initiative of the Canadian Education Statistics Council, a partnership between Statistics Canada and the Council of Ministers of Education, Canada that provides a set of statistical measures on education systems in Canada.More",2019-03-25
593. Number and percentage distribution of certificates granted to registered apprentices by major trade group and sex,Table: 37-10-0128-02,https://www150.statcan.gc.ca/t1/tbl1/en/tv.action?pid=3710012802,"Description: Number and percentage distribution of registered apprentice completions, by major trade group and sex, Canada. This table is included in Section D: Postsecondary education:...Description: Number and percentage distribution of registered apprentice completions, by major trade group and sex, Canada. This table is included in Section D: Postsecondary education: Postsecondary completions and graduation rates of the Pan Canadian Education Indicators Program (PCEIP). PCEIP draws from a wide variety of data sources to provide information on the school-age population, elementary, secondary and postsecondary education, transitions, education finance and labour market outcomes. The program presents indicators for all of Canada, the provinces, the territories, as well as selected international comparisons and comparisons over time. PCEIP is an ongoing initiative of the Canadian Education Statistics Council, a partnership between Statistics Canada and the Council of Ministers of Education, Canada that provides a set of statistical measures on education systems in Canada.More",2019-03-25
594. Number of apprenticeship program registrations,Table: 37-10-0023-01,https://www150.statcan.gc.ca/t1/tbl1/en/tv.action?pid=3710002301,"Description: Count of the all apprenticeship registrations, for Canada, provinces and territories by gender, registration status and major trade group for the most recent five years OR data is...Description: Count of the all apprenticeship registrations, for Canada, provinces and territories by gender, registration status and major trade group for the most recent five years OR data is available historically since 1991.More",2018-12-05
595. Number of certificates granted to registered apprentices,Table: 37-10-0024-01,https://www150.statcan.gc.ca/t1/tbl1/en/tv.action?pid=3710002401,"Description: Count of the all apprenticeship completions, for Canada, provinces and territories by major trade group,  age group, registration status and gender for the most recent five years OR...Description: Count of the all apprenticeship completions, for Canada, provinces and territories by major trade group,  age group, registration status and gender for the most recent five years OR data is available historically since 1991.More",2018-12-05
596. Number of certificates granted to registered apprentices and trade qualifiers,Table: 37-10-0089-01,https://www150.statcan.gc.ca/t1/tbl1/en/tv.action?pid=3710008901,"Description: Count of all  certificates by age groups, sex, major trade groups, apprentice or trade qualifier indicator, red seal or non-red seal indicator for Canada, provinces and territories for...Description: Count of all  certificates by age groups, sex, major trade groups, apprentice or trade qualifier indicator, red seal or non-red seal indicator for Canada, provinces and territories for the most recent five years OR data is available historically since 1991.More",2018-12-05
"597. Number of certificates granted to registered apprentices, and percentage by sex",Table: 37-10-0128-01,https://www150.statcan.gc.ca/t1/tbl1/en/tv.action?pid=3710012801,"Description: Number and percentage distribution of registered apprentice completions, by major trade group and sex, Canada. This table is included in Section D: Postsecondary education:...Description: Number and percentage distribution of registered apprentice completions, by major trade group and sex, Canada. This table is included in Section D: Postsecondary education: Postsecondary completions and graduation rates of the Pan Canadian Education Indicators Program (PCEIP). PCEIP draws from a wide variety of data sources to provide information on the school-age population, elementary, secondary and postsecondary education, transitions, education finance and labour market outcomes. The program presents indicators for all of Canada, the provinces, the territories, as well as selected international comparisons and comparisons over time. PCEIP is an ongoing initiative of the Canadian Education Statistics Council, a partnership between Statistics Canada and the Council of Ministers of Education, Canada that provides a set of statistical measures on education systems in Canada.More",2019-03-25
598. Number of employer enterprises newly born having survived one year,Table: 33-10-0139-01,https://www150.statcan.gc.ca/t1/tbl1/en/tv.action?pid=3310013901,"Description: Number of employer enterprises newly born having survived one year, by North American Industry Classification System (NAICS) and enterprise size.",2015-12-07
599. Number of employer enterprises newly born having survived two years,Table: 33-10-0140-01,https://www150.statcan.gc.ca/t1/tbl1/en/tv.action?pid=3310014001,"Description: Number of employer enterprises newly born having survived two years, by North American Industry Classification System (NAICS) and enterprise size.",2015-12-07
600. Number of persons employed in employer enterprise deaths,Table: 33-10-0142-01,https://www150.statcan.gc.ca/t1/tbl1/en/tv.action?pid=3310014201,"Description: Number of persons employed in employer enterprise deaths, by North American Industry Classification System (NAICS) and enterprise size.",2015-12-07
601. Number of persons employed in employer enterprises newly born,Table: 33-10-0141-01,https://www150.statcan.gc.ca/t1/tbl1/en/tv.action?pid=3310014101,"Description: Number of persons employed in employer enterprises newly born, by North American Industry Classification System (NAICS) and enterprise size.",2015-12-07
